{
  "Alignment": "example-value",
  "ApplyFontColor": "example-value",
  "BackgroundColor": "example-value",
  "BackgroundOpacity": "example-value",
  "DdsHandling": "example-value",
  "DdsXCoordinate": "example-value",
  "DdsYCoordinate": "example-value",
  "FallbackFont": "example-value",
  "FontColor": "example-value",
  "FontOpacity": "example-value",
  "FontResolution": "example-value",
  "FontScript": "example-value",
  "FontSize": "example-value",
  "Height": "example-value",
  "HexFontColor": "example-value",
  "OutlineColor": "example-value",
  "OutlineSize": "example-value",
  "ShadowColor": "example-value",
  "ShadowOpacity": "example-value",
  "ShadowXOffset": "example-value",
  "ShadowYOffset": "example-value",
  "StylePassthrough": "example-value",
  "SubtitlingType": "STANDARD",
  "TeletextSpacing": "example-value",
  "Width": "id-abc123",
  "XPosition": "example-value",
  "YPosition": "example-value"
}